job_title,company,location,description
"Jr Data Analyst","ABC Corp","Bangalore","Looking for a Jr. Data Analyst with Excel, SQL. Freshers welcome!"
"DATA ANALYST I","XYZ Ltd","India","Analyze data, build dashboards. Skills: SQL, Excel, Python."
"Data analyst","Startup Inc","","Work on numbers, reports, KPIs. Must know Excel."
"Business Analyst","Enterprise Co","Remote","Strong analytical skills, stakeholder management, SQL preferred."
"Analyst - Data","ABC Corp","Bangalore","Data analysis role. Tools: Excel, Power BI, SQL."
